{
  "profile_version": 1,
  "id": "provider-api-surface-YYYY-MM-DD",
  "provider": "provider-name",
  "api_surface": "structured-output-or-tool-calling",
  "model_scope": "all-supported-or-specific-family",
  "verified_at": "YYYY-MM-DD",
  "sources": [
    "https://official.example/docs"
  ],
  "json_schema_dialect": "2020-12-subset-or-unknown",
  "unsupported_keywords": [],
  "requirements": {
    "root_type": null,
    "require_additional_properties_false": false,
    "require_all_properties_required": false
  },
  "limits": {},
  "incompatible_features": [],
  "notes": []
}
